<?xml version="1.0" encoding="UTF-8"?>
	<wf:config xmlns:wf="http://www.odcgroup.com/wui-workflow" xmlns:xsi="http://www.w3.org/2001/XMLSchema-instance" xsi:schemaLocation="http://www.odcgroup.com/wui-workflow wui-workflow.xsd">
	<!-- 
		*************************************************************************************
																DO NOT MODIFY THIS FILE!

		This file has been generated automatically by Design Studio. 
		Any change will be lost when regenerated.
		*************************************************************************************
										Design Studio information of  pageflow file
										
		Project name     : pms-models
		Package          : //ds7899
		Generation user  : atripod
		Generation date  : Tue Sep 30 17:12:39 CEST 2014
		DS version       :  
		*************************************************************************************
	 -->
	
		
	<!-- 
		*****************************************************
		Design Studio information of pageflow model
		Model name       : DS7899
		Description      : 
		******************************************************
    -->	
    
	<!-- 
		*************************************
		DS7899 workflow
		*************************************
    -->

	<wf:workflow name="DS7899" graph="DS7899Graph">
	    <!-- declaration of the used panels -->
		<wf:abort-view url-redirector-class-name="com.odcgroup.uif.workflow.ConfigurableURLRedirector"/>
		<wf:error-view url="/page/common/OneModule?module=general/PageflowErrorModule"/>
		<wf:view state-key="EndState" url="exit"/>
	</wf:workflow>

	    
	<!--
		*************************************
		DS7899 graph
		*************************************
	-->
	
	<wf:graph name="DS7899Graph">
		<!-- ============================== -->	
	    <!-- declaration of the used states -->
	    <!-- ============================== -->
	    <wf:state key="EndState" is-terminal="true"/>
	    <wf:state key="ViewState"/>
   
    	<!-- ============================== -->
        <!-- declaration of init transition -->
        <!-- ============================== -->
        <wf:init-transition name="transition1" to-state="ViewState">        
	      	<wf:process class-name="com.odcgroup.tsl.core.wui.flow.CheckScreenProfileFlowService" stop-on-failure="false"/>
        </wf:init-transition>
        <!-- ============================== -->
        <!-- declaration of the transitions -->
        <!-- ============================== -->
        <wf:transition name="A" from-state="ViewState" to-redirector="true" >        
	      	<wf:process class-name="com.odcgroup.tsl.core.wui.flow.CheckScreenProfileFlowService" stop-on-failure="false"/>
  			<wf:process class-name="com.odcgroup.tsl.core.wui.process.RedirectorOnAttributeProcess"/>
			<wf:redirector>
 				<wf:result value="0">
 					<wf:transition to-state="ViewState" name="0" >
					      	<wf:process class-name="com.odcgroup.tsl.core.wui.flow.CheckScreenProfileFlowService" stop-on-failure="false"/>
 					</wf:transition>
 				</wf:result>
   				<wf:result state="ViewState" value="1" />
			</wf:redirector>
        </wf:transition>
        <wf:transition name="transition2" from-state="ViewState" to-state="EndState" >
	      	<wf:process class-name="com.odcgroup.tsl.core.wui.flow.CheckScreenProfileFlowService" stop-on-failure="false"/>
        </wf:transition>
	</wf:graph>


	</wf:config>
	